<?xml version="1.0" encoding="UTF-8"?>
<queryContext xmlns="http://www.example.org/query" xmlns:xsi="http://www.w3.org/2001/XMLSchema-instance"
	xsi:schemaLocation="http://www.example.org/query query.xsd ">
	<!-- 用户列表 -->
	<query id="user_list" key="id" tableName="用户列表" className="com.cnpc.framework.base.entity.User"
		pageSize="10"  widthType="px" order="id asc">
		<column key="rowIndex" header="序号" width="50" allowSort="false"/>
		<column key="id" header="id" hidden="true"/>
		<column key="version" header="version" hidden="true"/>
		<column key="name" header="姓名" operator="like" width="100" allowSort="true" />
		<column key="deptId" header="所在部门" align="left" width="100" fnRender="fnRenderDept"/>
		<column key="sex" header="性别" operator="eq" width="150" allowSort="true" render="1=男,0=女" />
		<column key="birthday" header="出生年月" operator="like" width="80" allowSort="true" dateFormat="yyyy-mm-dd" />
		<column key="loginName" header="登录名" operator="like" width="80" allowSort="true" />
		<column key="email" header="邮箱" align="left" operator="eq" width="100"  />
		<column key="mobile" header="手机" operator="eq" width="200" align="center"/>
	    <column key="qq" header="QQ" operator="eq" width="200" align="center" />
	</query>
	
	<!-- 角色列表 -->
	<query id="role_list" key="id" tableName="角色列表" className="com.cnpc.framework.base.entity.Role"
		pageSize="10"  widthType="px" order="sort asc" allowPaging="false">
		<column key="rowIndex" header="序号" width="50" allowSort="false"/>
		<column key="id" header="id" hidden="true"/> 
		<column key="version" header="version" hidden="true"/>
		<column key="name" header="名称" operator="like" width="100" allowSort="true" />
		<column key="code" header="编码" operator="eq" width="100" allowSort="true"/>
		<column key="deleted" header="是否可用" width="80" allowSort="true" render="1=禁用,0=可用" />
		<column key="remark" header="备注" width="100" allowSort="false" /> 
	</query>
	
	<!-- 角色用户列表  已经绑定该角色的用户 -->
    <query id="userRole_selected_list" key="id" tableName="角色用户列表（已绑定）" className="com.cnpc.framework.base.entity.UserRole"
		pageSize="10"  widthType="px" order="updateDateTime desc" allowPaging="true">
		<column key="rowIndex" header="序号" width="50" allowSort="false"/>
		<column key="id" header="id" hidden="true"/>
		<column key="version" header="version" hidden="true"/>
		<column key="roleId"  header="roleId" operator="eq"  hidden="true"/>
		<column key="user.name" header="用户名" operator="like" width="100" allowSort="true" />
		<column key="user.loginName" header="登录名" operator="eq" width="100" allowSort="true"/>
	</query>

	<!-- 角色授权列表  已经绑定该角色的权限列表 -->
	<query id="roleFunc_selected_list" key="id" tableName="角色功能列表（已绑定）"  pageSize="10"  widthType="px" order="f.levelCode desc" allowPaging="false">
		<sql>
			<![CDATA[
			  select rf.id id,rf.version version,rf.roleId roleId,f.name name,p.name pname,
			  f.code code from tbl_role_function rf
			  left join tbl_function f on rf.functionId=f.id
			  left join tbl_function p on f.parent_id=p.id
			  where 1=1 and f.functype!='0'
			]]>
		</sql>
		<column key="rowIndex" header="序号" width="50" allowSort="false"/>
		<column key="id" header="id" hidden="true"/>
		<column key="version" header="version" hidden="true"/>
		<column key="roleId"  header="roleId" operator="eq"  hidden="true"/>
		<column key="name" header="功能名" operator="like" width="100" align="left" allowSort="true" />
		<column key="code" header="功能编码" operator="eq" width="100" allowSort="true"/>
		<column key="pname" header="父功能" operator="eq" width="100" allowSort="true" align="left"/>
	</query>

	<!--功能数据权限-->
	<query id="ff_list" key="id" tableName="功能数据权限列表"  pageSize="10"  widthType="px" order="sort asc" allowPaging="false" className="com.cnpc.framework.base.entity.FunctionFilter">
		<column key="rowIndex" header="序号" width="50" allowSort="false"/>
		<column key="id" header="id" hidden="true"/>
		<column key="version" header="version" hidden="true"/>
		<column key="roleId" header="roleId" hidden="true" operator="eq"/>
		<column key="functionId" header="functionId" hidden="true" operator="eq"/>
		<column key="key" header="条件" operator="like" width="100" allowSort="true" />
		<column key="operator" header="操作符" operator="like" width="100" allowSort="true" />
		<column key="value" header="值" operator="like" width="100" allowSort="true" />
		<column key="classType" header="类型" operator="eq" width="100" allowSort="true"/>
	</query>

	<!-- 未绑定角色的用户 -->
	<query id="userRole_unselected_list" key="id" tableName="角色用户列表（未绑定）" pageSize="10"  widthType="px"  allowPaging="true">
       <sql>   
	      <![CDATA[   
	      select id,version,name,login_name from tbl_user where 
	      id not in (select userId from tbl_user_role where roleId=@roleId#)
          and 1=1 
          order by update_date_time desc
	      ]]>
	    </sql>
		<column key="rowIndex" header="序号" width="50" allowSort="false"/>
		<column key="id" header="id" hidden="true"/>
		<column key="version" header="version" hidden="true"/>
		<column key="name" header="用户名" operator="like" width="100" allowSort="true" />
		<column key="login_name" header="登录名" operator="eq" width="100" allowSort="true"/>
	</query>

	<!--通用用户选择-->
	<query id="user_select_list" key="id" tableName="用户选择" className="com.cnpc.framework.base.entity.User"
		   pageSize="10"  widthType="px" order="updateDateTime desc">
		<column key="isSelected" header="选择" fnRender="fnRenderSelectUser" />
		<column key="id" header="id" hidden="true" align="center" allowSort="false"/>
		<column key="rowIndex" header="序号" width="50" allowSort="false"/>
		<column key="version" header="version" hidden="true"/>
		<column key="name" header="姓名" operator="like" width="100" allowSort="true" />
		<column key="sex" header="性别" operator="eq" width="150" allowSort="true" render="1=男,0=女" />
		<column key="email" header="邮箱" align="left" operator="eq" width="100"  />
		<column key="mobile" header="手机"  operator="eq" width="200" align="center"/>
		<column key="qq" header="QQ" hidden="true" operator="eq" width="200" align="center" />
	</query>
</queryContext>